{
  "id": "test:session-001",
  "event_id": "test:event-001",
  "poi_id": "test:poi-001",
  "location": {
    "latitude": 51.128,
    "longitude": 71.43
  },
  "starts_at": "2030-01-15T13:00:00+05:00",
  "ends_at": null,
  "price_kzt_per_person": null,
  "status": "scheduled",
  "booking_url": null,
  "sources": [
    {
      "source_id": "test-source-001",
      "provider": "test_fixture",
      "url": "https://example.invalid/test-only/poi-001",
      "retrieved_at": "2030-01-15T10:00:00+05:00",
      "license": "Synthetic test fixture only; no real-world facts",
      "rights_basis_url": "https://example.invalid/test-only/rights",
      "storage_allowed": true,
      "indexing_allowed": true,
      "is_test": true
    }
  ],
  "provenance": [
    {
      "source_id": "test-source-001",
      "external_id": "session-001",
      "fields": [
        "starts_at",
        "status"
      ],
      "observed_at": "2030-01-15T10:00:00+05:00"
    }
  ],
  "is_test": true
}
